source,job_id,title,company,city,location_full,country,zip,salary_min,salary_max,salary_period,salary_currency,employment_type,date_posted,valid_through,tags,category,description,requirements,what_we_offer,contact_name,contact_email,url,direct_apply,remote
euraxess,441844,"Research Grant (BI), for the conduct of R&D activities by a graduate with a Master degree enrolled in a Course non-leading to an academic degree - Ref. ª SF/2026/15",Faculdade de Ciências Médicas|NOVA Medical School da Universidade NOVA de Lisboa.,,"Number of offers: 1, Portugal, Nova Medical School",,,,,,,,2 June 202,2026-06-18,Biological sciences; Other; Medical sciences; Other Profession; Not funded by a EU programme,research,"There is an open call for applications for a Research Grant (BI), for the conduct of R&D activities by a graduate with a Master degree enrolled in a Course non-leading to an academic degree, under reference SF/2026/15 in the scope of the PI - IF- 2024.17504.PEX - HERO project, at the institution... ...",,,,,https://euraxess.ec.europa.eu/jobs/441844,False,
euraxess,441843,CALL FOR EXPRESSIONS OF INTEREST - MIA-Portugal (GA:857524),Universidade de Coimbra,,"Number of offers: 1, Portugal, University of Coimbra",,,,,,,,2 June 202,2026-06-18,Other; Recognised Researcher (R2); Horizon 2020,research,"CALL FOR EXPRESSIONS OF INTERESTPostdoctoral/Auxiliary Researcher Position University of Coimbra opens a call to hire one Postdoctoral/Auxiliary Researcher to join Marco Candeias’ Lab at the Multidisciplinary Institute of Ageing - MIA-Portugal, co-funded by the European Horizon2020 TEAMING Program...",,,,,https://euraxess.ec.europa.eu/jobs/441843,False,
euraxess,441841,Post-doctoral researcher in reproducible experimentation and network acceleration for generative AI – 18-month Fixed-Term Contract,IMT - Institut Mines-Télécom,,"Number of offers: 1, France, IMT Atlantique, Nantes, 44000, 4 Rue Alfred Kastler, 44300 Nantes",,,,,,,,2 June 202,2026-06-30,Computer science; Computer systems; Engineering; Computer engineering; First Stage Researcher (R1); Not funded by a EU programme,research,"A leading general engineering school within IMT (Institut Mines-Télécom), the number one group of engineering schools in France, IMT Atlantique aims to support transitions and train responsible engineers. We place scientific and technical excellence at the service of education, research, and...",,,,,https://euraxess.ec.europa.eu/jobs/441841,False,
euraxess,441839,Assistant Professor (F/M),University of Warsaw,,"Number of offers: 1, Poland, Faculty of Modern Languages, Institute of Iberian and Ibero-American Studies",,,,,,,,2 June 202,2026-07-02,Literature; Recognised Researcher (R2); Not funded by a EU programme,research,"COMPETITION ANNOUNCEMENT Dean of the Faculty of Modern Languages, University of Warsaw invites applications for the position of Assistant Professor (F/M) (research and teaching academics) at the Institute of Iberian and Ibero-American Studies Position details: Position: Assistant Professor (F/M...",,,,,https://euraxess.ec.europa.eu/jobs/441839,False,
euraxess,441840,Post-doctoral Fellowship in Diffusion Neuroimaging – 24-month Fixed-Term Contract,IMT - Institut Mines-Télécom,,"Number of offers: 1, France, IMT Atlantique, Brest, 29200, 655 avenue du technopôle 29280 Plouzané",,,,,,,,2 June 202,2026-06-30,Technology; Medical technology; Neurosciences; Neuroinformatics; First Stage Researcher (R1); Not funded by a EU programme,research,"A leading general engineering school within IMT (Institut Mines-Télécom), the number one group of engineering schools in France, IMT Atlantique aims to support transitions and train responsible engineers. We place scientific and technical excellence at the service of education, research, and...",,,,,https://euraxess.ec.europa.eu/jobs/441840,False,
euraxess,441838,Internationalization Project Manager (IPM),Museo Nacional de Ciencias Naturales (MNCN-CSIC),,"Number of offers: 1, Spain, Museo Nacional de Ciencias Naturales (MNCN-CSIC), Madrid, 28006, Madrid, Jose Gutierrez Abascal 2",,,,,,,,2 June 202,2026-06-21,Biological sciences; Biodiversity; Environmental science; Ecology; Global change; Geosciences; Hydrology; Other Profession; Not funded by a EU programme,research,The National Museum of Natural Sciences (MNCN-CSIC) is seeking an Internationalization Project Manager (IPM) to coordinate the newly created International Project Management Unit. This role is funded under the UNEARTHING-MNCN project and aims to increase the success rate in international project...,,,,,https://euraxess.ec.europa.eu/jobs/441838,False,
euraxess,441836,Research Assistant / PhD Student in Cryptography and Privacy Engineering,TU Darmstadt,,"Number of offers: 1, Germany, TU Darmstadt / ENCRYPTO, Darmstadt, 64289, Pankratiusstr. 2",,,,,,,,2 June 202,2026-06-15,Computer science; Other; First Stage Researcher (R1); Horizon Europe (other),research,The Cryptography and Privacy Engineering Group (ENCRYPTO) at the Department of Computer Science of the Technical University of Darmstadt offers a position as doctoral researcher for doing cutting-edge research in applied cryptography/secure multi-party computation. The full position is to be filled...,,,,,https://euraxess.ec.europa.eu/jobs/441836,False,
euraxess,441835,Postdoc Position in Immunomodulatory self-assembling peptide-based biomaterials,University of Southern Denmark,,"Number of offers: 1, Denmark, University of Southern Denmark/The Faculty of Engineering, Odense, 5230, Syddanmark, Campusvej 55",,,,,,,,2 June 202,2026-07-31,Engineering; Biomaterial engineering; Recognised Researcher (R2); Not funded by a EU programme,research,"The Biotechnology section at the Department of Green Technology, Faculty of Engineering, University of Southern Denmark invites applications for one Postdoc position in immunomodulatory biomaterials starting 1/9/2026 (or as soon as possible afterwards, according to mutual agreement). The position is...",,,,,https://euraxess.ec.europa.eu/jobs/441835,False,
euraxess,441834,University of Arts Linz – Institute of Fine Arts and Cultural Studies – Vacancy for a Professor of ‘Curatorial Practice’ according to Section 99 (1) of the Austrian Universities Act (UG),Kunstuniversität Linz,,"Number of offers: 1, Austria, Kunstuniversität Linz, Linz, 4020, Hauptplatz 6",,,,,,,,2 June 202,2026-07-15,Other; Leading Researcher (R4); Not funded by a EU programme,research,The University of Arts Linz invites applications for a part-time position as University Professor of ‘Curatorial Practice’ at the Institute of Fine Arts and Cultural Studies starting on 1 September 2028 according to Section 99 (1) of the Austrian Universities Act (UG 2002). The employment rate is 37...,,,,,https://euraxess.ec.europa.eu/jobs/441834,False,
euraxess,441831,TECHNICIAN,IBIMA Plataforma BIONAND,,"Number of offers: 1, Spain, ibima, malaga",,,,,,,,2 June 202,2026-06-10,Medical sciences; Health sciences; Other Profession; Other EU programme,research,THE BIOMEDICAL RESEARCH INSTITUTE OF MÁLAGA NEEDS TO HIRE A PROFESSIONAL WITH THE FOLLOWING PROFILE: TECHNICIANReference: 2026/136Project: Multiple Sclerosis Research Line & Personalized Medicine in Neurology and New Therapeutic Perspectives Research Line.Research Line: IBIMA-C-01 NEUROIMMUNOLOGY...,,,,,https://euraxess.ec.europa.eu/jobs/441831,False,
euraxess,441833,Postdoctoral Fellow in Political Science (3-4 years) ref 303060,University of Oslo,,"Number of offers: 1, Norway, Department of Political Science",,,,,,,,2 June 202,2026-09-01,Political sciences; Recognised Researcher (R2); Not funded by a EU programme,research,The Department of Political Science is recruiting up to two Postdoctoral Fellows (SKO 1352) with specialization in political data science or comparative politics. We are looking for an excellent candidate with the potential of pursuing a long-term career in academia. The successful applicant will be...,,,,,https://euraxess.ec.europa.eu/jobs/441833,False,
euraxess,441828,Three-Year PhD Candidate or Postdoctoral Fellow in Testing Quantum Computing Use Cases on a Quantum Computer,Simula Research Laboratory,,"Number of offers: 1, Norway, Simula Research Laboratory, Oslo, 0164",,,,,,,,2 June 202,2026-06-19,Computer science; First Stage Researcher (R1); Other EU programme,research,"Simula: Solving fundamental problems in ICT that benefit society.Simula’s vision is to be an excellent research lab, educating future technology leaders and providing independent advice to the government. We want to be an innovator and innovation partner and apply our expertise to problems that...",,,,,https://euraxess.ec.europa.eu/jobs/441828,False,
euraxess,441832,University of Arts Linz – Institute of Fine Arts and Cultural Studies – Vacancy for a Professor of ‘Curatorial Practice’ according to Section 99 (1) of the Austrian Universities Act (UG),Kunstuniversität Linz,,"Number of offers: 1, Austria, Kunstuniversität Linz, Linz, 4020, Hauptplatz 6",,,,,,,,2 June 202,2026-07-15,Other; Leading Researcher (R4); Not funded by a EU programme,research,The University of Arts Linz invites applications for a part-time position as University Professor of ‘Curatorial Practice’ at the Institute of Fine Arts and Cultural Studies starting on 1 September 2027 according to Section 99 (1) of the Austrian Universities Act (UG 2002). The employment rate is 37...,,,,,https://euraxess.ec.europa.eu/jobs/441832,False,
euraxess,441827,PhD Research Fellowship in Political Science (3-4 years) ref 303034,University of Oslo,,"Number of offers: 1, Norway, Department of Political Science",,,,,,,,2 June 202,2026-09-01,Political sciences; First Stage Researcher (R1); Not funded by a EU programme,research,"We are offering one PhD position with specialisation in either comparative politics, or political data science. The successful applicant(s) will be part of the research project “Authoritarian Threats to Scientific Knowledge” (AutoKnow), which is funded by the European Research Council. The PhD...",,,,,https://euraxess.ec.europa.eu/jobs/441827,False,
euraxess,441830,3 postdoctoral positions within the framework of its ISDALab research group,UPF Barcelona School of Management,,"Number of offers: 3, Spain, UPF Barcelona School of Management",,,,,,,,2 June 202,2026-06-30,All; Other Profession; Horizon Europe - MSCA,research,"UPF Barcelona School of Management (UPF-BSM), the Business School of Pompeu Fabra University (Spain) invites applications for 3 postdoctoral positions within the framework of its ISDALab research group ( https://www.bsm.upf.edu/en/innovation-sustainability-data-lab-isdalab ). Candidates should be...",,,,,https://euraxess.ec.europa.eu/jobs/441830,False,
euraxess,441826,Postdoctoral Research Fellow in Ethics of Embodied AI (ref 302728),University of Oslo,,"Number of offers: 1, Norway, Department of Informatics",,,,,,,,2 June 202,2026-09-01,Computer science; Recognised Researcher (R2); Not funded by a EU programme,research,"This position is part of The Norwegian Centre for Embodied AI (NCEI, https://www.ntnu.edu/web/ncei ), one of Norway’s six national AI centres. NCEI brings together leading robotics and AI groups with key partners from across Norway with international collaborators to study how intelligence emerges...",,,,,https://euraxess.ec.europa.eu/jobs/441826,False,
euraxess,441825,Research Grant (Ref. BIPD-6/CESAM/REUSE/2026 ),University of Aveiro,,"Number of offers: 1, Portugal, CESAM - Centre for Environmental and Marine Studies, Aveiro, 3810-193, Campus Universitário de Santiago",,,,,,,,2 June 202,2026-06-19,Chemistry; Environmental science; Engineering; Recognised Researcher (R2); Horizon Europe,research,"A call is now open for the award of 1 Postdoctoral Research Scholarship (BIPD) within the scope of the project “REUSE - Enzymatic CO2 Capture in a Rotating Packed Bed and Electrocatalytic CO2 Reduction to Useful Products” (GA 101172954), with financial support from Horizonte Europa, from Center for...",,,,,https://euraxess.ec.europa.eu/jobs/441825,False,
euraxess,441822,"IMIB26_C47 Research Support Technician with a degree in Nursing, at the Virgen de la Arrixaca University Clinical Hospital - Cardiology",Instituto Murciano de Investigación Biosanitaria Virgen de la Arrixaca (IMIB),,"Number of offers: 1, Spain, Fundación para la Formación e Investigación Sanitarias de la Región de Murcia, Murcia, 30120, Murcia, Pabellón Docente del Hospital Clínico Universitario Virgen de la Arrixaca, 3ª planta Calle Campo nº 12, CP. 30.120 El Palmar, Murcia",,,,,,,,2 June 202,2026-06-10,Other; Other Profession; Other EU programme,research,"A COMPETITION is announced for the HIRING OF A RESEARCH SUPPORT TECHNICIAN, WITH A DEGREE IN NURSING, for the research project ""Integrated monitoring and prediction system for HEART failure with advanced interpretation of biosignals based on AI for home use. CARD-IA. Public-private collaboration...",,,,,https://euraxess.ec.europa.eu/jobs/441822,False,
euraxess,441824,Research Grant (Ref. BIPD-5/CESAM/REUSE/2026 ),University of Aveiro,,"Number of offers: 1, Portugal, CESAM - Centre for Environmental and Marine Studies, Aveiro, 3810-193, Campus Universitário de Santiago",,,,,,,,2 June 202,2026-06-19,Environmental science; Chemistry; Engineering; Recognised Researcher (R2); Horizon Europe,research,"A call is now open for the award of 1 Postdoctoral Research Scholarship (BIPD) within the scope of the project “REUSE - Enzymatic CO2 Capture in a Rotating Packed Bed and Electrocatalytic CO2 Reduction to Useful Products” (GA 101172954), with financial support from Horizonte Europa, from Center for...",,,,,https://euraxess.ec.europa.eu/jobs/441824,False,
euraxess,441820,DATA AND QUALITY MANAGER,IBIMA Plataforma BIONAND,,"Number of offers: 1, Spain, ibima, malaga",,,,,,,,2 June 202,2026-06-10,Medical sciences; Health sciences; Other Profession; Other EU programme,research,THE BIOMEDICAL RESEARCH INSTITUTE OF MÁLAGA NEEDS TO HIRE A PROFESSIONAL WITH THE FOLLOWING PROFILE: DATA AND QUALITY MANAGERReference: 2026/134Project description: The European Comprehensive Cancer Centre Network (EUnetCCC JA)Research line: IBIMA-BE-23 NEW HORIZONS FOR ONCOLOGICAL...,,,,,https://euraxess.ec.europa.eu/jobs/441820,False,
euraxess,441823,Researcher (ref 301395),University of Oslo,,"Number of offers: 1, Norway, Department of Literature, Area Studies and European Languages",,,,,,,,2 June 202,2026-08-10,Literature; Established Researcher (R3); Horizon Europe - ERC,research,"We are seeking a researcher who will be responsible for Work Package 3 (WP3): Book Censorship and Poetry in Francoist Spain. This subproject investigates how Franco’s regime censored Spanish literature and poetry; how it implemented its censorship and propaganda plans; how writers, in particular...",,,,,https://euraxess.ec.europa.eu/jobs/441823,False,
euraxess,441819,IMIB26_C48 Master's Level Research Support Technician at Virgen de la Arrixaca University Clinical Hospital - Cardiology,Instituto Murciano de Investigación Biosanitaria Virgen de la Arrixaca (IMIB),,"Number of offers: 1, Spain, Fundación para la Formación e Investigación Sanitarias de la Región de Murcia, Murcia, 30120, Murcia, Pabellón Docente del Hospital Clínico Universitario Virgen de la Arrixaca, 3ª planta Calle Campo nº 12, CP. 30.120 El Palmar, Murcia",,,,,,,,2 June 202,2026-06-11,Other; Other Profession; Other EU programme,research,"A COMPETITION is announced for the HIRING OF A MASTER TECHNICIAN TO SUPPORT RESEARCH for the research project ""Integrated monitoring and prediction system for HEART failure with advanced interpretation of biosignals based on AI for home use. CARD-IA. Public-private collaboration projects (CPP2023...",,,,,https://euraxess.ec.europa.eu/jobs/441819,False,
euraxess,441815,Postdoctoral Researcher,IBIMA Plataforma BIONAND,,"Number of offers: 1, Spain, ibima, malaga",,,,,,,,2 June 202,2026-06-10,Medical sciences; Health sciences; Other Profession; Other EU programme,research,THE BIOMEDICAL RESEARCH INSTITUTE OF MÁLAGA NEEDS TO HIRE A PROFESSIONAL WITH THE FOLLOWING PROFILE: Postdoctoral ResearcherReference: 2026/132Project: 00300000200100445 - BRECISE - Biomarker Research and Evaluation for Clinical Implementation and Supporting Systems EnhancementProject description...,,,,,https://euraxess.ec.europa.eu/jobs/441815,False,
euraxess,441814,Call for a public offer for the recruitment of Researching staff linked to Universitat Politècnica de València (UPV),Universitat Politècnica de València,,"Number of offers: 1, Spain, UPV, Valencia",,,,,,,,2 June 202,2026-06-16,Chemistry; Physics; First Stage Researcher (R1); Not funded by a EU programme,research,Resolution of the Rector of the Universitat Politècnica de València announcing a selection process for a fixed-term employment predoctoral contract within the framework of a Research Project: Organic and perovskite transistors for computer networks https://www.upv.es/entidades/SRH/conypi/A1276230 ...,,,,,https://euraxess.ec.europa.eu/jobs/441814,False,
euraxess,441811,The Chair of Energy Network Technology in the Department of Environmental and Energy Process Engineering has a position for a full-time Project Researcher (m/f/d) – Reference number: 2605WPA,Personalabteilung der Montanuniversität Leoben,,"Number of offers: 1, Austria, Montanuniversität Leoben",,,,,,,,2 June 202,2026-06-23,All; First Stage Researcher (R1); Not funded by a EU programme,research,"As a modern university with a strong focus on research and teaching, the Montanuniversität Leoben (Technical University of Leoben) offers outstanding opportunities for career advancement in both scientific and non-scientific domains.The Chair of Energy Network Technology in the Department of...",,,,,https://euraxess.ec.europa.eu/jobs/441811,False,
euraxess,441813,HRS2026/259 MODULO A: Técnico FP Grado Superior en el Grupo de Análisis de Biomoléculas/ MODULE A: Higher Vocational Training Technician in the Biomolecule Analysis Group.,UNIVERSIDAD POLITECNICA DE MADRID,,"Number of offers: 1, Spain, Escuela Técnica Superior de Ingeniería Agronómica, Alimentaria y de Biosistemas Escuela Técnica Superior de Ingeniería Agronómica, Alimentaria y de Biosistemas, Madrid, 28040, Madrid, Avenida Puerta de Hierro, 2",,,,,,,,2 June 202,2026-06-15,Engineering; Sound engineering; Other Profession; Not funded by a EU programme,research,"1) Ejecución de protocolos experimentales bioquímicos, genéticos,microscopía y cultivo de plantas. 2) Gestión de pedidos y provisión de material. 3)Representación de datos, análisis estadístico y emisión de informes.1) Execution of experimental protocols in biochemistry, genetics, microscopy and...",,,,,https://euraxess.ec.europa.eu/jobs/441813,False,
euraxess,441810,Technician in Health Documentation and Administration,IBIMA Plataforma BIONAND,,"Number of offers: 1, Spain, ibima, malaga",,,,,,,,2 June 202,2026-06-10,Medical sciences; Health sciences; Other Profession; Other EU programme,research,"Project description: IBIMA B-10 SKIN CANCER. DERMATOLOGY UNIT, HOSPITAL COMPLEX, VIRGEN DE LA VICTORIA UNIVERSITY HOSPITAL.Research line: Clinical studies such as Palmoplantar Pustulosis, Atopic Dermatitis, Pyoderma Gangrenosum.Responsible Researcher: ENRIQUE HERRERA ACOSTAPlace of Implementation...",,,,,https://euraxess.ec.europa.eu/jobs/441810,False,
euraxess,441809,an open competition for the position of assistant (f/m/n)* in the research and teaching staff at the Department of Genetics,Wroclaw Medical University,,"Number of offers: 1, Poland, Wroclaw Medical University, Wrocław, 50-367, Wyb. L. Pasteura 1",,,,,,,,2 June 202,2026-07-03,Medical sciences; Medicine; First Stage Researcher (R1); Not funded by a EU programme,research,"Entry Requirements:scientific achievements and the workstation requirements ( www.umw.edu.pl/pl/rada-dyscypliny-nauki-medyczne/konkursy-na-stanowiska… ),professional title – MSc in Biotechnology,full right to practice medicine (refers to the profession for which specific...",,,,,https://euraxess.ec.europa.eu/jobs/441809,False,
euraxess,441808,Call for a public offer for the recruitment of Researching staff linked to Universitat Politècnica de València (UPV),Universitat Politècnica de València,,"Number of offers: 1, Spain, UPV, Valencia",,,,,,,,2 June 202,2026-06-16,Technology; Telecommunications technology; First Stage Researcher (R1); Not funded by a EU programme,research,Resolution of the Rector of the Universitat Politècnica de València announcing a selection process for an indefinite employment contract within the framework of a Line of Research:R&D line: Development of Artificial Intelligence tools for Antenna Design https://www.upv.es/entidades/SRH/conypi ...,,,,,https://euraxess.ec.europa.eu/jobs/441808,False,
euraxess,441807,PhD Student (CeNT-22-2026),University of Warsaw,,"Number of offers: 1, Poland, Centre of New Technologies, University of Warsaw",,,,,,,,2 June 202,2026-06-23,Chemistry; Other; First Stage Researcher (R1); Not funded by a EU programme,research,"Director of Centre of New Technologies of the University of Warsaw, with the leader of research conducted in CeNT UW, announces the opening of the position of PhD Student in the Laboratory of Chemical Biology – Centre of New Technologies of the University of Warsaw.Project title: Horizon for...",,,,,https://euraxess.ec.europa.eu/jobs/441807,False,
